{
  "schema_version": "0.1",
  "run_id": "20260328T120000Z-a91c2f",
  "status": "in_progress",
  "started_at": "2026-03-28T12:00:00Z",
  "execution_order": [],
  "adapters": [],
  "artifacts": {
    "manifest_path": "manifest.json",
    "raw_root": "raw",
    "normalized_root": "normalized",
    "logs_root": "logs"
  }
}