{
  "schema_version": "0.1",
  "run_id": "20260328T120000Z-a91c2f",
  "status": "partial_success",
  "started_at": "2026-03-28T12:00:00Z",
  "finished_at": "2026-03-28T12:05:10Z",
  "execution_order": ["jest", "playwright", "k6", "trivy"],
  "summary": {
    "total_selected": 4,
    "total_executed": 4,
    "passed": 2,
    "failed": 1,
    "timed_out": 0,
    "not_found": 1,
    "normalization_failed": 0,
    "duration_ms_total": 5000
  },
  "adapters": [
    {
      "name": "jest",
      "status": "pass",
      "duration_ms": 1000,
      "normalized_result": "normalized/jest.result.json",
      "raw_artifacts": {
        "stdout": "raw/jest/stdout.log",
        "stderr": "raw/jest/stderr.log",
        "tool_output": "raw/jest/tool-output.json"
      }
    },
    {
      "name": "playwright",
      "status": "failed",
      "duration_ms": 1500,
      "normalized_result": "normalized/playwright.result.json",
      "raw_artifacts": {
        "stdout": "raw/playwright/stdout.log",
        "stderr": "raw/playwright/stderr.log",
        "tool_output": "raw/playwright/tool-output.json"
      }
    },
    {
      "name": "k6",
      "status": "pass",
      "duration_ms": 2500,
      "normalized_result": "normalized/k6.result.json",
      "raw_artifacts": {
        "stdout": "raw/k6/stdout.log",
        "stderr": "raw/k6/stderr.log",
        "tool_output": "raw/k6/tool-output.json"
      }
    },
    {
      "name": "trivy",
      "status": "not_found",
      "duration_ms": 0,
      "normalized_result": "normalized/trivy.result.json",
      "raw_artifacts": {
        "stdout": "raw/trivy/stdout.log",
        "stderr": "raw/trivy/stderr.log"
      }
    }
  ],
  "artifacts": {
    "manifest_path": "manifest.json",
    "raw_root": "raw",
    "normalized_root": "normalized",
    "logs_root": "logs"
  }
}